{
  "schema_version": 1,
  "produced_by": "options/coverage_cli",
  "read_only": true,
  "subject": {
    "label": "spot + margin, all accounts",
    "exposure_usd": 4860.0
  },
  "policy": {
    "target_ratio": 0.5,
    "min_tenor_days": 180,
    "max_premium_bps": 1200
  },
  "plan": {
    "exposure_usd": 4860.0,
    "target_ratio": 0.5,
    "covered_usd": 0.0,
    "uncovered_usd": 4860.0,
    "coverage_pct": 0.0,
    "is_covered": false,
    "burned_off": false,
    "legs": [],
    "triggers": [
      "insurance is bought against a thesis, not a price: re-evaluate when the position it protects is closed"
    ],
    "notes": [
      "NO VENUE AVAILABLE \u2014 position is uninsured",
      "derive: V3 mainnet pre-launch: production orderbook verified empty on 2026-09-26",
      "lighter_options: Lighter options do not exist yet; placeholder for the expected venue"
    ]
  }
}
